context_score	matched_terms	Phase	Main goal	Source objects/dependencies	Definitions/objects	Current code modules	Target modules/objects	Proof goals	Phase status	Object link policy	Object link explanation	Child object scope
20	dtn; dirichletlaplacian; schur; boundary; laplacian; operator; interior; elimination	3	Schur/DtN core in neutral derivation order	1.2.6-1.3.3; S00-S06; notation/import firewall 1.1.5 closed; BR06 route separation before 3.1.	DirichletLaplacian -> InteriorBlock -> Inverse -> Elimination -> DtN -> generalized	Smoke/GeneratedDirichletEntry.lean; GeneratedInterior*.lean; GeneratedTopBoundaryDtNSM3gR.lean; GeneratedGeneralizedTopBoundaryDtNSM3hR.lean	neutral API according to object register for: DirichletLaplacian -> InteriorBlock -> Inverse -> Elimination -> DtN -> generalized	encapsulate the existing derived-only chain by domain role; do not reinvent product/inverse formulas; route classification must be complete before wrapping boundary operators.	W	scope_only	umbrella/routing phase; child phases own the registered objects	BR06, S00, S01, S02, S03, S04, S05, S06
18	dtn; schur; generalizeddtn; boundary; matrix; operator	10	Spectral, finite physical, transfermatrix, and Schur-bridge consumers after operational boundary matrices	4.1 ExecBoundaryMatrix; 3.6/3.7 BoundaryOperator/GeneralizedDtN where needed; regime split for P05/P06; not Phase 8/9 unless explicitly bridged	SP0-SP5, P00-P06, TM0-TM2, BR08/BR09/CD8/CD9. Modular forms and q/H_D are not in this phase.	Finite/ExecSpectral/*; Foundation/MatrixAlgebra.lean; Finite/StateSpace.lean; Arithmetic/Schur/MobiusTransfer.lean; finite dynamics seeds	CNNA/PillarA/Spectral/*; CNNA/PillarA/Physics/*; CNNA/PillarA/Transfer/*; late Bridge modules	Independent Path B after Phase 4. Spectral/operator-algebra objects consume finite matrices and regimes, not modular-form/j prerequisites. Transfermatrix consumes Schur recurrence and feeds BR08 later.	W	scope_only	umbrella/routing phase; child phases own the registered objects	SP0, SP1, P00, P01, P02, P03, P04, P05, P06, SP2, SP3, SP4, SP5, TM0, TM1, TM2, BR09, BR08, CD8, CD9
17	dtn; schur; generalizeddtn; boundary; operator	3.7	GeneralizedDtN/MultiSchur	3.6/S06	GeneralizedBoundaryOperatorProfile	GeneratedGeneralizedTopBoundaryDtNSM3hR.lean; GeneratedMultiSchurSM4.lean; Coupling/*.lean	neutral API according to object register for: GeneralizedBoundaryOperatorProfile	MultiSchur only as an extension of the BoundaryOperatorProfile	W	direct	phase owns direct registered object(s) through object.Phase == phase.Phase	
14	dtn; schur; boundary; interface; complement; handoff	19.3	Formal emergence-path forensics for open-system dynamics	A regime/complement objects; DtN/Schur handoff chain; A->C interface; C/OQS consumer path; graph source-sink/dominator data	Open-system emergence-path localization; boundary/complement-to-effective-dynamics path diagnostics; proof-bottleneck map	future checked A/C modules plus repo_inventory/raw_export path analysis	LEG18; future diagnostic report only; no operational CNNA object generated from graph metadata	Later localize where open effective dynamics emerges in the formal derivation chain, while requiring actual CNNA proofs for any physical/mathematical emergence statement.	W	direct	phase owns direct registered object(s) through object.Phase == phase.Phase	
13	dtn; schur; boundary; matrix; operator	1.1.1.1.0.6	Phase 3 to Phase 4 consumer-contract direction lock	1.1.1.1.0.5; GEN-1 canonical generator policy; Phase 3.6 BoundaryOperatorProfile; Phase 4.1 ExecBoundaryMatrix	BoundaryOperatorProfile exports a consumer-ready contract for the operational generator path; Phase 4 consumes Phase 3 output; Phase 3 does not import Phase 4 implementation	Future Schur/DtN neutral wrappers; future Operational/ExecComplex wrappers	LEG24; updated Phase 3.6/4.1 phase goals and scratchpad consumer_contract_direction fields	Keep the dependency direction mathematically correct while making the downstream consumer contract visible early: Phase 3.6 must publish the boundary/operator profile in the shape Phase 4 needs, without importing Phase 4.	G	direct	phase owns direct registered object(s) through object.Phase == phase.Phase	
13	dtn; schur; boundary; interface; interior	1.3.1	Neutralize boundary/interface/interior partition profile	1.3; generated boundary/interior partition modules	Boundary / interface / interior partition	CNNA/PillarA/Arithmetic/Smoke/GeneratedBoundaryInteriorPartition.lean; CNNA/PillarA/Finite/CutSpec.lean; CNNA/PillarA/Finite/BoundaryPorts.lean	CNNA/PillarA/Schur/PartitionProfile.lean	Partition is a source layer for Schur/DtN, not a consumer-side convention.	W	direct	phase owns direct registered object(s) through object.Phase == phase.Phase	
13	dtn; schur; boundary; laplacian; elimination	10.4.1	Multiscale Schur-duality bridge: horizontal sector elimination versus vertical level recursion	CD7; S05; O05; TM0; TM1; TM2; BR06; BR07; S07; S08	BR08; BR09	No canonical module yet; sources to audit include Schur/DtN modules, Cayley-Dickson structural modules, Transfer/MobiusTransfer anchors, and generated boundary route modules.	CNNA/PillarA/Bridge/SchurHorizontalVerticalDuality.lean; CNNA/PillarA/Bridge/SubsystemSchurInvariantBifurcation.lean	prove or refute positively that horizontal sector Schur elimination and vertical level-recursion Schur elimination are two compatible factorizations/aspects of one multiscale Schur decomposition of the derived Dirichlet-Laplacian; record exact commutation/naturality conditions rather than an analogy	W	direct	phase owns direct registered object(s) through object.Phase == phase.Phase	
13	dtn; schur; boundary; matrix; operator	4.1	ExecBoundaryMatrix	3.6/O01 plus consumer-contract direction lock 1.1.1.1.0.6	ExecMatrixProfile	GeneratedMultiSchurExecBoundaryOperatorFromSM3fqPlusSM4q.lean; GeneratedLevelHistoryExecMatrixFromSM6bRecheckSM8.lean	neutral API according to object register for: ExecMatrixProfile	Matrix carrier over ExecComplex from BoundaryOperator provenance; consume the Phase-3.6 boundary/operator profile contract rather than reconstructing Schur/DtN data.	W	direct	phase owns direct registered object(s) through object.Phase == phase.Phase	
12	dtn; schur; boundary; matrix	3.0	Boundary-source route separation: full-cut matrix geometry versus IdealThread scalar collapse	S07; S08; ExistingIdealThreadNoGo; FullBoundaryAudit; Phase 3 Schur/DtN profiles.	BR06 Boundary-route extrema contract.	CNNA/PillarA/Arithmetic/BoundarySource/ExistingIdealThreadNoGo.lean; CNNA/PillarA/Arithmetic/Core/FullBoundaryAudit.lean; CNNA/PillarA/Finite/*; CNNA/PillarA/DtN/*	CNNA/PillarA/Schur/BoundaryRouteContract.lean	Before wrapping Schur/DtN, state which proofs consume the full CutSpec route and which are only scalar/thread-route audits. A nontrivial boundary matrix must be sourced from full/generated boundary data, not from an IdealThread singleton unless a separate lifting theorem exists.	W	direct	phase owns direct registered object(s) through object.Phase == phase.Phase	
12	dirichletlaplacian; dirichlet laplacian; laplacian; operator	3.1	Dirichlet Laplacian and partition	G04-G05/S00	DirichletLaplacianProfile	Finite/DirichletLaplacian.lean; Smoke/GeneratedDirichletEntry.lean	neutral API according to object register for: DirichletLaplacianProfile	operator source from partition, weights, adjacency; clarify Exec mirror	W	direct	phase owns direct registered object(s) through object.Phase == phase.Phase	
12	dtn; schur; boundary; operator	3.6	DtN BoundaryOperator	3.5/S05	BoundaryOperatorProfile	GeneratedTopBoundaryDtNSM3gR.lean; DtN/DtN.lean	CNNA/PillarA/Schur/BoundaryOperatorProfile.lean; consumer-contract notes for Operational/ExecComplex phase 4.1	Boundary operator as a profile derivable inside A and later exportable. The wrapper must also publish the consumer-ready shape needed by Phase 4.1, without importing Phase 4 or depending on Exec arithmetic implementation.	W	direct	phase owns direct registered object(s) through object.Phase == phase.Phase	
11	dtn; schur; complement	1.1.1.1.0.16	Global ontic subsystem-minimality postulate and emergence-order lock	IDEAL_infty formal provenance whole; subsystem/cut/approximant discipline; noOuter/HasOuter regime split; complement-family contract; Schur/DtN emergence chain; prior global no-go guardrails	LEG35 ontic subsystem-minimality contract; POST1 global postulate; GNG22 no non-subsystem ontic primitives; allowed primitive = subsystem-being only	masters/cnna_roadmap_master.yaml; scripts/generate_tables.py; generated global postulate table; no Lean source	Global postulate rendered before workflows and phase table; object/proof-dossier record LEG35; scratchpad inheritance and no-go enforcement for later phases	Planning/architecture proof: dynamics, spectra, algebra, arithmetic, geometry, stochasticity, openness, unitarity and physical interpretation are not primitive inputs. They must be derived from subsystem/cut, complement/regime and Schur/DtN consequences inside IDEAL_infty formal provenance.	G	direct	owns LEG35 directly as the global ontic-minimality contract	
11	dtn; schur; matrix	10.4	Transfermatrix formalization from Schur recurrence	3.6-3.7; 4.0 thread-recursion audit; BR07; TM0-TM2	TM0 Transfermatrix T_k; TM1 Transfermatrix product; TM2 Moebius/continued-fraction relation	CNNA/PillarA/Arithmetic/Schur/MobiusTransfer.lean (anchor/status only); CNNA/PillarA/Arithmetic/Schur/Recurrence.lean; no full M2(Z[lambda]) proof; ...	CNNA/PillarA/Transfer/TransfermatrixTk.lean; CNNA/PillarA/Transfer/Transfermatrixproduct.lean; CNNA/PillarA/Transfer/Moebiuscontinuedfractionrelation.lean	Formalize vertical Schur recurrence independently of modular forms. Later BR08 uses it with horizontal Schur/DtN data.	W	direct	phase owns direct registered object(s) through object.Phase == phase.Phase	BR09, BR08, CD8, CD9
10	dtn; schur	1.1.1.1.0.13	Derived-only exact quadratic algebra provenance lock: no free sqrt(D)	1.1.1.1.0.12 scalar architecture; O00 ExecComplex floor; O05/O06 operational discriminant path; mathlib QuadraticAlgebra and AdjoinRoot reference docs; Cayley-Dickson noncircularity lock	LEG32; O09 reinterpreted as a required discriminant-indexed exact quadratic algebra schema; O10/BR14 future proof-carrying instantiation gate; GNG19 no-free-sqrt rule	Planning/master only; no Lean code change.	masters/cnna_roadmap_master.yaml; generated scalar architecture decisions, guardrails, proof dossiers, and future phase contracts	Lock that sqrt(D) is never introduced as an axiom or external number. The operational route is: Schur/DtN/charpoly/determinant -> proof-carrying D : Int -> canonical algebra with theta^2 = D over Q -> exact coordinate computations -> rational/integer invariant projection. If D is missing, backjump to the discriminant source rather than patching a scalar consumer.	G	direct	phase owns direct registered object(s) through object.Phase == phase.Phase	
9	schur; boundary; bright; complement; interior	1.3	Regime, partition, and complement Profile neutralization	1.2.6; current partition/regime/complement modules; preliminary object IDs G05-G10	PartitionProfile; RegimeProfile; ComplementProfile	GeneratedBoundaryInteriorPartition.lean; Sectors/*.lean; Network/*.lean; A_to_B.lean	CNNA/PillarA/Schur/PartitionProfile.lean; CNNA/PillarA/Regime/*.lean; CNNA/PillarA/Regime/Complement/*.lean	noOuter/hasOuter are A-derived regimes. Complement data is A-internal and must not leak directly to bright Pillar B.	W	scope_only	umbrella/routing phase; child phases own the registered objects	G05, G06, G07, G08, G09, G10
8	schur; boundary; matrix; operator	4	Operational ExecComplex arithmetic path from BoundaryOperator	3.6-3.7; O01-O06; BR07 thread-recursion audit before 4.1.	BoundaryMatrix -> recurrence -> polynomial -> window -> D_op -> target policy	GeneratedMultiSchurExecBoundaryOperator*.lean; GeneratedOperationalDeterminantCoefficientRecurrenceSM9e.lean; GeneratedOperationalQuadratic*.lean	neutral API according to object register for: BoundaryMatrix -> recurrence -> polynomial -> window -> D_op -> target policy	neutralize SM9h core: all values via ExecComplex, no target values as sources; recurrence provenance must be audited before arithmetic interpretation.	W	scope_only	umbrella/routing phase; child phases own the registered objects	BR07, O07, O08, BR12, BR13, O01, O02, O03, O04, O05, O10, BR14, O06
7	schur; boundary; matrix	1.1.1.1.0.14	Phase 5-10 dependency bifurcation lock: number-theory/modular path separated from spectral/physical consumers	v36 phase/object register; object phase audit for N/L/M/SP/P/TM/BR/CD groups; Phase 4.1 ExecBoundaryMatrix dependency; Phase 8/9 modular-form chain	LEG33 phase-path bifurcation and dependency repair contract; GNG20 no artificial modular-form bottleneck for physical/spectral finite consumers	masters/cnna_roadmap_master.yaml; generated_exports/phase_roadmap.generated.tsv; object register; no Lean code	Corrected Phase 5-10 roadmap: Path A number-theory/geometric/modular/analytic targets; Path B spectral/physical/transfer/bridge targets	Planning proof: SP0/SP1/P00-P06 consume Phase 4.1/finite boundary matrices and regime data, not Phase 8 modular/j objects. M00-M07 belong to the modular path. TM0-TM2 belong to Schur/transfer path and feed BR08 rather than modular-form phases.	G	direct	phase owns direct registered object(s) through object.Phase == phase.Phase	
7	schur; boundary; complement	1.1.1.1.0.8	Horizontal/vertical Schur-complement duality dependency-order lock	Review insight; existing Schur/CD/arithmetic plan; no Lean code movement.	LEG27; GNG14; BR08/BR09/CD8 dependency-order correction; one-generator bridge boundary	Planning-only decision gate; existing code not modified.	masters/cnna_roadmap_master.yaml; generated format decisions, workflow policy, object proof dossiers	record that horizontal sector Schur and vertical level Schur may be investigated only after their separate routes are neutralized/proved; forbid using the duality as an input to earlier phases	G	direct	phase owns direct registered object(s) through object.Phase == phase.Phase	
7	schur; interior; elimination	3.5	InteriorEliminationData	3.4/S04	InteriorEliminationProfile	GeneratedInteriorEliminationCertificateSM3fR.lean	neutral API according to object register for: InteriorEliminationProfile	Schur elimination data from TwoSidedInv	W	direct	phase owns direct registered object(s) through object.Phase == phase.Phase	
6	schur; boundary	1.1.1.1.0.7	IdealThread/CutSpec.full extremal-route contract and string-analogy boundary lock	Code-checked definitions: InfiniteThread/IdealThread, IdealThread.carrier/family/coarsen, CutSpec.full, ExistingIdealThreadNoGo, FullBoundaryAudit.	LEG25; IdealThread singleton route; CutSpec.full maximal route; scalar-collapse warning; comparison-only string-analogy boundary.	CNNA/PillarA/Foundation/SubstrateClass.lean; CNNA/PillarA/ToC/Contract.lean; CNNA/PillarA/Finite/CutSpec.lean; CNNA/PillarA/Arithmetic/BoundarySource/ExistingIdealThreadNoGo.lean; CNNA/PillarA/Arithmetic/Core/FullBoundaryAudit.lean	No Lean module in this decision gate. Later neutral modules: CNNA/PillarA/ToC/IdealThreadProfile.lean; CNNA/PillarA/Finite/FullCutProfile.lean; CNNA/PillarA/Schur/BoundaryRouteContract.lean.	Record that IdealThread is singleton per level and coarsen-fixed under deterministic substrates, while CutSpec.full carries T.carrier. Do not use IdealThread as a full-boundary source; keep string-like analogy as interpretation/comparison only.	G	direct	phase owns direct registered object(s) through object.Phase == phase.Phase	
6	schur; matrix	1.1.1.5.4	Module theory context ledger	1.1.1.5; SCF37; workflow policy; repo inventory; object register; scratchpad	Track local established mathematical background per module as formal language, proof method, library/API context, implementation substrate, or comparison lemma context.	masters/cnna_roadmap_master.yaml; scripts/generate_tables.py; repo_inventory/raw_export; generated_exports; tables; figures; tool_state if introduced later	module-theory-context ledger TSV; active-module slice	Tooling/governance proof goal: implement the Module theory context ledger without modifying Lean sources unless a later explicit Lean phase accepts that change. Ensure theory semantics: Local established theory is allowed formalization context, never ontic CNNA generator. Examples: Matrix, Finset, Polynomial, graph/linear algebra, Schur-style algebraic methods.	W	no_direct_object	tooling/governance subphase; it prepares generated views/ledgers and owns no CNNA mathematical object until a future object row is explicitly registered	
6	schur; interface	10.4.2	Arithmetic-CD compatibility as Schur-duality corollary	BR08; BR09; CD3; CD6; CD7; O05; N03/N04/N05 as available; TM0/TM1/TM2	CD8	CNNA/PillarA/Arithmetic/CayleyDickson/ArithmeticCDBridge.lean; CNNA/PillarA/Arithmetic/Convergence/CDArithmeticCompatibility.lean; CNNA/PillarA/Arithmetic/Convergence/QuaternionRamanujanInterface.lean (source/seed only, not final canonical theorem)	CNNA/PillarA/Bridge/ArithmeticCayleyDicksonCompatibility.lean	derive the algebraic norm/CD norm compatibility only as a consequence of the closed horizontal/vertical Schur bridge; do not assert compatibility from analogy or from parallel source-site similarity	W	direct	phase owns direct registered object(s) through object.Phase == phase.Phase	
6	schur; matrix	10.5	Spectral/physical and transfer path closeout before late bridges and Pillar-B export	10.1-10.4; P00-P06; SP0-SP5; TM0-TM2	path closeout; A->B readiness audit; no modular-form dependencies unless explicitly recorded	no current heat-kernel module; MatrixExponential is related but not HeatKernelProfile; no current spectral-zeta module; ...	CNNA/PillarA/Schur/HeatkernelKt.lean; CNNA/PillarA/Schur/SpectralzetazetaH.lean; CNNA/PillarA/Schur/Spectraldimension.lean; ...	Check all Path B objects have minimal dependencies and do not import modular/j/L-function modules by convenience.	W	no_direct_object	baseline/audit/closeout/infrastructure phase with no registered object ownership	
6	schur; boundary	19.5	Thread/full-boundary derivation-geometry and string-analogy diagnostic side-road	S07; S08; BR06; BR07; S05; S06; LT5; proof dossiers and derivation graph metadata.	LEG26 Reflective thread/full-boundary analogy diagnostic boundary.	repo_inventory/raw_export/*; future neutral ToC/FullCut/Schur route profiles.	Documentation/diagnostic generated views only unless a later derived-only theorem needs a code module.	Document analogy boundaries and graph diagnostics after object closure. No generative input, no premature physical theorem, no bypass of derived-only route.	W	direct	phase owns direct registered object(s) through object.Phase == phase.Phase	
6	dtn; matrix	20.6	Context-filtered documentation slices: all sections retained, only query-relevant rows emitted	20; DBR0-DBR5; Single YAML master; generated_exports/*.tsv; context_documentation_profiles; scripts/generate_context_doc.py	DBR6 context documentation slice generator: generated-secondary packet that preserves the full documentation section topology while filtering each section to context-relevant rows by query/profile.	masters/cnna_roadmap_master.yaml; scripts/generate_context_doc.py; generated_exports/*.tsv; context_docs/<slug>/*	DBR6; context_filter_manifest.json; context_section_summary.tsv; <slug>_context_documentation.tex/pdf; curated profile dtn-matrix	Closed as tooling/documentation function. It must not create a second truth source: every slice is a filtered view over YAML/export data and remains subject to Lean-primary and expert-review rules.	G	direct	phase owns direct registered object(s) through object.Phase == phase.Phase	
6	schur; boundary	4.0	Thread-recursion arithmetic-shadow audit before operational arithmetic wrappers	S07; BR06; RecursiveSchurSource; MobiusTransfer; CharpolyExec; operational discriminant chain.	BR07 Thread-recursion arithmetic-shadow audit profile.	CNNA/PillarA/Arithmetic/Schur/RecursiveSchurSource.lean; CNNA/PillarA/Arithmetic/Schur/MobiusTransfer.lean; CNNA/PillarA/Arithmetic/Schur/CharpolyExec.lean; CNNA/PillarA/Arithmetic/Notation.lean	CNNA/PillarA/Operational/ThreadRecursionAudit.lean	Audit whether the scalar Schur/Mobius recurrence is actually tied to IdealThread singleton data, full-boundary diagonal data, or an intermediate generated source. Keep D=-3/-4 claims as derived arithmetic outputs only after the chain is code-proven and not as string-analogy input.	W	direct	phase owns direct registered object(s) through object.Phase == phase.Phase	O07, O08, BR12, BR13
6	schur; interface	6.5	Arithmetic-CD compatibility source-site audit and bridge-precondition register, not final compatibility theorem	6; CD3/CD6/CD7; O05 when available; final theorem deferred to 10.4.2 after BR08	precondition audit for CD8; no public-final Arithmetic-CD theorem in this phase	CNNA/PillarA/Arithmetic/CayleyDickson/ArithmeticCDBridge.lean; CNNA/PillarA/Arithmetic/Convergence/CDArithmeticCompatibility.lean; CNNA/PillarA/Arithmetic/Convergence/QuaternionRamanujanInterface.lean	CNNA/PillarA/Bridge/ArithmeticCayleyDicksonCompatibility.lean	Only source-site audit: CD8 is not closed here and must wait for Schur-duality bridge BR08/BR09.	W	no_direct_object	baseline/audit/closeout/infrastructure phase with no registered object ownership	
